{
  "schemaVersion": 1,
  "recordKind": "ShippableAsset",
  "assetId": "UI007",
  "manifestCategory": "UI",
  "purpose": "ATP Icon",
  "runtimePath": "Assets/ImmunWar/Art/UI/P0/UI_ATP.png",
  "fallbackAssetId": "PLACEHOLDER_UI007",
  "releaseCritical": true,
  "sourceType": "ai_generated",
  "creatorOrProvider": "OpenAI image generation",
  "sourceUrlOrJobId": "exec-24923701-cccb-4428-bbb3-98b1735ecfe3",
  "acquiredOrGeneratedAtUtc": "2026-09-19T00:28:00Z",
  "generation": {"provider":"OpenAI","model":"built-in image generation","modelVersion":null,"prompt":"Golden ATP HUD currency icon with white lightning bolt and teal rim.","settings":"transparent PNG; square; P0 style references","referenceAssetIds":["DEF006"]},
  "status": "Approved",
  "rights": {
    "commercialUse": "Allowed",
    "modification": "Allowed",
    "embeddedRedistribution": "Allowed",
    "attribution": "N/A",
    "aiInputUse": "Allowed",
    "territoryOrPlatformLimits": null
  },
  "evidence": {
    "evidenceType": "AIProviderTerms",
    "nameAndVersion": "OpenAI terms reviewed 2026-09-18",
    "urlOrOrderId": "https://openai.com/policies/service-terms/",
    "snapshotPath": "Docs/AssetProvenance/evidence/openai-image-terms-2026-09-18.md",
    "snapshotSha256": "57fa5dc60c51ff83c5a2e7918b30dae570016c5159a6369a905b58eb403cf71c",
    "attributionText": null
  },
  "rawSha256": "6dbf59a7cc825dc7d48efe1a7de7d59252ad5ed046a9e927a51c2450d83c0fca",
  "approvedExportSha256": "6dbf59a7cc825dc7d48efe1a7de7d59252ad5ed046a9e927a51c2450d83c0fca",
  "recheckAtUtc": "2027-03-19T00:00:00Z",
  "review": {
    "reviewer": "Project owner (standing image approval confirmed in Codex session)",
    "reviewedAtUtc": "2026-09-19T00:28:00Z",
    "notes": "Selected under standing image approval; 32px readability, alpha, provenance, and hash verified."
  }
}
