{
  "schemaVersion": 1,
  "recordKind": "ShippableAsset",
  "assetId": "DEF001",
  "manifestCategory": "Defender",
  "purpose": "Macrophage tank/blocker",
  "runtimePath": "Assets/ImmunWar/Art/Defenders/P0/DEF_Macrophage.png",
  "fallbackAssetId": "PLACEHOLDER_DEF001",
  "releaseCritical": true,
  "sourceType": "ai_generated",
  "creatorOrProvider": "OpenAI image generation",
  "sourceUrlOrJobId": "exec-261a1718-6dc2-4aec-a32f-c1259786fce2",
  "acquiredOrGeneratedAtUtc": "2026-09-18T08:55:00Z",
  "generation": {
    "provider": "OpenAI",
    "model": "built-in image generation",
    "modelVersion": null,
    "prompt": "Friendly rounded macrophage tank/blocker, teal and aqua, transparent background, no references.",
    "settings": "transparent PNG; square",
    "referenceAssetIds": []
  },
  "status": "Approved",
  "rights": {
    "commercialUse": "Allowed",
    "modification": "Allowed",
    "embeddedRedistribution": "Allowed",
    "attribution": "N/A",
    "aiInputUse": "Allowed",
    "territoryOrPlatformLimits": null
  },
  "evidence": {
    "evidenceType": "AIProviderTerms",
    "nameAndVersion": "OpenAI terms reviewed 2026-09-18",
    "urlOrOrderId": "https://openai.com/policies/service-terms/",
    "snapshotPath": "Docs/AssetProvenance/evidence/openai-image-terms-2026-09-18.md",
    "snapshotSha256": "57fa5dc60c51ff83c5a2e7918b30dae570016c5159a6369a905b58eb403cf71c",
    "attributionText": null
  },
  "rawSha256": "0e95455a7bd758cf0f73a35bc09ace16ec3307b676636ba7764203341cbf96ce",
  "approvedExportSha256": "0e95455a7bd758cf0f73a35bc09ace16ec3307b676636ba7764203341cbf96ce",
  "recheckAtUtc": "2027-03-18T00:00:00Z",
  "review": {
    "reviewer": "Project owner (confirmed in Codex session)",
    "reviewedAtUtc": "2026-09-18T16:09:15Z",
    "notes": "Approved by the project owner after visual review recommendation; technical PNG, alpha, provenance, and hash checks passed."
  }
}
