{
    "schemaVersion":  1,
    "recordKind":  "ShippableAsset",
    "assetId":  "AI012",
    "manifestCategory":  "character",
    "purpose":  "Super pathogen movement animation sheet",
    "runtimePath":  "Assets/ImmunWar/Art/Batch/Characters/boss_sheet.png",
    "fallbackAssetId":  null,
    "releaseCritical":  false,
    "sourceType":  "ai_generated",
    "creatorOrProvider":  "OpenAI image generation via Codex",
    "sourceUrlOrJobId":  "exec-2e806b6c-0fca-4dbb-999b-4c2c3fd0cc13",
    "acquiredOrGeneratedAtUtc":  "2026-09-20T14:32:25Z",
    "generation":  {
                       "provider":  "OpenAI",
                       "model":  "image_gen",
                       "modelVersion":  null,
                       "prompt":  "Consistent Immune War glossy cellular game art based on existing project reference: Super pathogen movement animation sheet; transparent 4x2 motion frames for units or themed 16:9 organ map plate.",
                       "settings":  "Image editing with project reference assets where applicable",
                       "referenceAssetIds":  [
                                                 "ENE_Boss"
                                             ]
                   },
    "status":  "Approved",
    "rights":  {
                   "commercialUse":  "Allowed",
                   "modification":  "Allowed",
                   "embeddedRedistribution":  "Allowed",
                   "attribution":  "N/A",
                   "aiInputUse":  "Allowed",
                   "territoryOrPlatformLimits":  null
               },
    "evidence":  {
                     "evidenceType":  "AIProviderTerms",
                     "nameAndVersion":  "OpenAI Terms of Use effective 2026-01-01",
                     "urlOrOrderId":  "https://openai.com/policies/row-terms-of-use/",
                     "snapshotPath":  "Docs/AssetProvenance/evidence/openai-terms-2026-09-19.txt",
                     "snapshotSha256":  "5e32a72a7c3bf0bf58fd0ca13de43d6afe1d0f9fcba5b7fe5587c28182826279",
                     "attributionText":  null
                 },
    "rawSha256":  "33f941c84d6aaae1edd40a84234b38c08e6b1c9eb66133df84291866100faa3d",
    "approvedExportSha256":  "33f941c84d6aaae1edd40a84234b38c08e6b1c9eb66133df84291866100faa3d",
    "recheckAtUtc":  null,
    "review":  {
                   "reviewer":  "Codex visual and technical review for requested import",
                   "reviewedAtUtc":  "2026-09-20T14:32:25Z",
                   "notes":  "Visually inspected output at native resolution, checked grid count and alpha, and approved for the requested project batch import."
               }
}
