{
  "schemaVersion": 1,
  "recordKind": "ShippableAsset",
  "assetId": "ENV003",
  "manifestCategory": "Environment",
  "purpose": "Vessel Junction",
  "runtimePath": "Assets/ImmunWar/Art/Environment/Lung/ENV_Vessel_Junction3.png",
  "fallbackAssetId": "PLACEHOLDER_ENV003",
  "releaseCritical": true,
  "sourceType": "ai_generated",
  "creatorOrProvider": "OpenAI image generation",
  "sourceUrlOrJobId": "exec-32618d14-3c6b-49ae-800d-bf19342a260c",
  "acquiredOrGeneratedAtUtc": "2026-09-19T00:20:00Z",
  "generation": {"provider":"OpenAI","model":"built-in image generation","modelVersion":null,"prompt":"Top-down three-way lung blood-vessel T junction tile with transparent exterior.","settings":"transparent PNG; square; P0 style references","referenceAssetIds":["DEF001","ENE001"]},
  "status": "Approved",
  "rights": {
    "commercialUse": "Allowed",
    "modification": "Allowed",
    "embeddedRedistribution": "Allowed",
    "attribution": "N/A",
    "aiInputUse": "Allowed",
    "territoryOrPlatformLimits": null
  },
  "evidence": {
    "evidenceType": "AIProviderTerms",
    "nameAndVersion": "OpenAI terms reviewed 2026-09-18",
    "urlOrOrderId": "https://openai.com/policies/service-terms/",
    "snapshotPath": "Docs/AssetProvenance/evidence/openai-image-terms-2026-09-18.md",
    "snapshotSha256": "57fa5dc60c51ff83c5a2e7918b30dae570016c5159a6369a905b58eb403cf71c",
    "attributionText": null
  },
  "rawSha256": "477f485070ee0a5e3655ec4220a5f54ffc9abde948cc68880d326708b4ebc08b",
  "approvedExportSha256": "477f485070ee0a5e3655ec4220a5f54ffc9abde948cc68880d326708b4ebc08b",
  "recheckAtUtc": "2027-03-19T00:00:00Z",
  "review": {
    "reviewer": "Project owner (standing image approval confirmed in Codex session)",
    "reviewedAtUtc": "2026-09-19T00:20:00Z",
    "notes": "Selected under standing image approval; path readability, alpha, provenance, and runtime hash verified."
  }
}
