{
    "schemaVersion":  1,
    "recordKind":  "ShippableAsset",
    "assetId":  "AI001",
    "manifestCategory":  "character",
    "purpose":  "Macrophage idle and attack animation sheet",
    "runtimePath":  "Assets/ImmunWar/Art/Batch/Characters/macrophage_sheet.png",
    "fallbackAssetId":  null,
    "releaseCritical":  false,
    "sourceType":  "ai_generated",
    "creatorOrProvider":  "OpenAI image generation via Codex",
    "sourceUrlOrJobId":  "exec-03dcf359-b80a-48bc-8ed5-42f6524da487",
    "acquiredOrGeneratedAtUtc":  "2026-09-19T13:23:28Z",
    "generation":  {
                       "provider":  "OpenAI",
                       "model":  "image_gen",
                       "modelVersion":  null,
                       "prompt":  "Batch generation using existing Immune War P0 reference art; create consistent transparent animation frames, lung background, and UI kit.",
                       "settings":  "Image editing with project reference assets where applicable",
                       "referenceAssetIds":  [
                                                 "DEF_Macrophage"
                                             ]
                   },
    "status":  "Approved",
    "rights":  {
                   "commercialUse":  "Allowed",
                   "modification":  "Allowed",
                   "embeddedRedistribution":  "Allowed",
                   "attribution":  "N/A",
                   "aiInputUse":  "Allowed",
                   "territoryOrPlatformLimits":  null
               },
    "evidence":  {
                     "evidenceType":  "AIProviderTerms",
                     "nameAndVersion":  "OpenAI Terms of Use effective 2026-01-01",
                     "urlOrOrderId":  "https://openai.com/policies/row-terms-of-use/",
                     "snapshotPath":  "Docs/AssetProvenance/evidence/openai-terms-2026-09-19.txt",
                     "snapshotSha256":  "5e32a72a7c3bf0bf58fd0ca13de43d6afe1d0f9fcba5b7fe5587c28182826279",
                     "attributionText":  null
                 },
    "rawSha256":  "391ad7c608f497dc23f39e33509c6aea15d10380cc58f79db50c1edba5489694",
    "approvedExportSha256":  "391ad7c608f497dc23f39e33509c6aea15d10380cc58f79db50c1edba5489694",
    "recheckAtUtc":  null,
    "review":  {
                   "reviewer":  "Codex visual and technical review for requested import",
                   "reviewedAtUtc":  "2026-09-19T13:23:28Z",
                   "notes":  "Inspected generated sheet or plate at native game scale; checked style, frame count or transparency and planned Unity import. Owner requested batch generation and project integration."
               }
}
