{
    "schemaVersion":  1,
    "recordKind":  "ShippableAsset",
    "assetId":  "ENV005",
    "manifestCategory":  "Environment",
    "purpose":  "Infection Decal",
    "runtimePath":  "Assets/ImmunWar/Art/Environment/Final/ENV_InfectionDecal.png",
    "fallbackAssetId":  "ENV005_FALLBACK",
    "releaseCritical":  false,
    "sourceType":  "ai_generated",
    "creatorOrProvider":  "OpenAI image generation",
    "sourceUrlOrJobId":  "exec-6e56a204-0277-475c-957b-6d8e66c8867c",
    "acquiredOrGeneratedAtUtc":  "2026-09-19T00:48:00Z",
    "status":  "Approved",
    "rights":  {
                   "commercialUse":  "Allowed",
                   "modification":  "Allowed",
                   "embeddedRedistribution":  "Allowed",
                   "attribution":  "N/A",
                   "aiInputUse":  "Allowed",
                   "territoryOrPlatformLimits":  null
               },
    "evidence":  {
                     "evidenceType":  "AIProviderTerms",
                     "nameAndVersion":  "OpenAI terms reviewed 2026-09-18",
                     "urlOrOrderId":  "https://openai.com/policies/service-terms/",
                     "snapshotPath":  "Docs/AssetProvenance/evidence/openai-image-terms-2026-09-18.md",
                     "snapshotSha256":  "57fa5dc60c51ff83c5a2e7918b30dae570016c5159a6369a905b58eb403cf71c",
                     "attributionText":  null
                 },
    "rawSha256":  "84aba80f1edd3c5fbd16c94dc2804094a11c23d76bbb65f7c3fb801b7ea37918",
    "approvedExportSha256":  "84aba80f1edd3c5fbd16c94dc2804094a11c23d76bbb65f7c3fb801b7ea37918",
    "recheckAtUtc":  "2027-03-19T00:48:00Z",
    "review":  {
                   "reviewer":  "Project owner (standing image approval confirmed in Codex session)",
                   "reviewedAtUtc":  "2026-09-19T00:48:00Z",
                   "notes":  "Selected by Codex under the project owner standing image approval; alpha, provenance, and runtime hash verified."
               },
    "generation":  {
                       "provider":  "OpenAI",
                       "model":  "built-in image generation",
                       "modelVersion":  null,
                       "prompt":  "Top-down toxic infection decal with purple microbe specks.",
                       "settings":  "transparent PNG; square; selected under standing image approval",
                       "referenceAssetIds":  [
                                                 "ENE002"
                                             ]
                   }
}
