{
    "schemaVersion":  1,
    "recordKind":  "ShippableAsset",
    "assetId":  "AI005",
    "manifestCategory":  "character",
    "purpose":  "T cell idle and attack animation sheet",
    "runtimePath":  "Assets/ImmunWar/Art/Batch/Characters/tcell_sheet.png",
    "fallbackAssetId":  null,
    "releaseCritical":  false,
    "sourceType":  "ai_generated",
    "creatorOrProvider":  "OpenAI image generation via Codex",
    "sourceUrlOrJobId":  "exec-fd942ac5-86fc-4c2f-a563-2a070ec4fccb",
    "acquiredOrGeneratedAtUtc":  "2026-09-20T14:32:25Z",
    "generation":  {
                       "provider":  "OpenAI",
                       "model":  "image_gen",
                       "modelVersion":  null,
                       "prompt":  "Consistent Immune War glossy cellular game art based on existing project reference: T cell idle and attack animation sheet; transparent 4x2 motion frames for units or themed 16:9 organ map plate.",
                       "settings":  "Image editing with project reference assets where applicable",
                       "referenceAssetIds":  [
                                                 "DEF_TCell"
                                             ]
                   },
    "status":  "Approved",
    "rights":  {
                   "commercialUse":  "Allowed",
                   "modification":  "Allowed",
                   "embeddedRedistribution":  "Allowed",
                   "attribution":  "N/A",
                   "aiInputUse":  "Allowed",
                   "territoryOrPlatformLimits":  null
               },
    "evidence":  {
                     "evidenceType":  "AIProviderTerms",
                     "nameAndVersion":  "OpenAI Terms of Use effective 2026-01-01",
                     "urlOrOrderId":  "https://openai.com/policies/row-terms-of-use/",
                     "snapshotPath":  "Docs/AssetProvenance/evidence/openai-terms-2026-09-19.txt",
                     "snapshotSha256":  "5e32a72a7c3bf0bf58fd0ca13de43d6afe1d0f9fcba5b7fe5587c28182826279",
                     "attributionText":  null
                 },
    "rawSha256":  "3f3ddd5e2289f218a5b2c16df30c9c824cb4818176d94dcadf0088be25e92df1",
    "approvedExportSha256":  "3f3ddd5e2289f218a5b2c16df30c9c824cb4818176d94dcadf0088be25e92df1",
    "recheckAtUtc":  null,
    "review":  {
                   "reviewer":  "Codex visual and technical review for requested import",
                   "reviewedAtUtc":  "2026-09-20T14:32:25Z",
                   "notes":  "Visually inspected output at native resolution, checked grid count and alpha, and approved for the requested project batch import."
               }
}
