{
    "schemaVersion":  1,
    "recordKind":  "ShippableAsset",
    "assetId":  "ENV007",
    "manifestCategory":  "Environment",
    "purpose":  "Brain Landmark",
    "runtimePath":  "Assets/ImmunWar/Art/Environment/Brain/ENV_Brain.png",
    "fallbackAssetId":  "ENV007_FALLBACK",
    "releaseCritical":  false,
    "sourceType":  "ai_generated",
    "creatorOrProvider":  "OpenAI image generation",
    "sourceUrlOrJobId":  "exec-e358ff32-600c-4d7a-bcbd-17eb6b99e96f",
    "acquiredOrGeneratedAtUtc":  "2026-09-19T00:48:00Z",
    "status":  "Approved",
    "rights":  {
                   "commercialUse":  "Allowed",
                   "modification":  "Allowed",
                   "embeddedRedistribution":  "Allowed",
                   "attribution":  "N/A",
                   "aiInputUse":  "Allowed",
                   "territoryOrPlatformLimits":  null
               },
    "evidence":  {
                     "evidenceType":  "AIProviderTerms",
                     "nameAndVersion":  "OpenAI terms reviewed 2026-09-18",
                     "urlOrOrderId":  "https://openai.com/policies/service-terms/",
                     "snapshotPath":  "Docs/AssetProvenance/evidence/openai-image-terms-2026-09-18.md",
                     "snapshotSha256":  "57fa5dc60c51ff83c5a2e7918b30dae570016c5159a6369a905b58eb403cf71c",
                     "attributionText":  null
                 },
    "rawSha256":  "6dd96881ca9db53e2dc4e3256ef70c4219b2797bf4f92894844b98aaeb0904a1",
    "approvedExportSha256":  "6dd96881ca9db53e2dc4e3256ef70c4219b2797bf4f92894844b98aaeb0904a1",
    "recheckAtUtc":  "2027-03-19T00:48:00Z",
    "review":  {
                   "reviewer":  "Project owner (standing image approval confirmed in Codex session)",
                   "reviewedAtUtc":  "2026-09-19T00:48:00Z",
                   "notes":  "Selected by Codex under the project owner standing image approval; alpha, provenance, and runtime hash verified."
               },
    "generation":  {
                       "provider":  "OpenAI",
                       "model":  "built-in image generation",
                       "modelVersion":  null,
                       "prompt":  "Stylized medically recognizable brain landmark with cyan immune highlights.",
                       "settings":  "transparent PNG; square; selected under standing image approval",
                       "referenceAssetIds":  [

                                             ]
                   }
}
