{
    "schemaVersion":  1,
    "recordKind":  "ShippableAsset",
    "assetId":  "UI004",
    "manifestCategory":  "UI",
    "purpose":  "NK Cell Icon",
    "runtimePath":  "Assets/ImmunWar/Art/UI/Tactical/UI_Icon_NKCell.png",
    "fallbackAssetId":  "UI004_FALLBACK",
    "releaseCritical":  false,
    "sourceType":  "ai_generated",
    "creatorOrProvider":  "OpenAI image generation",
    "sourceUrlOrJobId":  "derived:DEF004",
    "acquiredOrGeneratedAtUtc":  "2026-09-19T00:36:00Z",
    "status":  "Approved",
    "rights":  {
                   "commercialUse":  "Allowed",
                   "modification":  "Allowed",
                   "embeddedRedistribution":  "Allowed",
                   "attribution":  "N/A",
                   "aiInputUse":  "Allowed",
                   "territoryOrPlatformLimits":  null
               },
    "evidence":  {
                     "evidenceType":  "AIProviderTerms",
                     "nameAndVersion":  "OpenAI terms reviewed 2026-09-18",
                     "urlOrOrderId":  "https://openai.com/policies/service-terms/",
                     "snapshotPath":  "Docs/AssetProvenance/evidence/openai-image-terms-2026-09-18.md",
                     "snapshotSha256":  "57fa5dc60c51ff83c5a2e7918b30dae570016c5159a6369a905b58eb403cf71c",
                     "attributionText":  null
                 },
    "rawSha256":  "0336782cea0dec39584894c374b52d880b9c682f01aaee1e8f337cfe2094b67a",
    "approvedExportSha256":  "0336782cea0dec39584894c374b52d880b9c682f01aaee1e8f337cfe2094b67a",
    "recheckAtUtc":  "2027-03-19T00:36:00Z",
    "review":  {
                   "reviewer":  "Project owner (standing image approval confirmed in Codex session)",
                   "reviewedAtUtc":  "2026-09-19T00:36:00Z",
                   "notes":  "Selected by Codex under the project owner standing image approval; alpha, provenance, and runtime hash verified."
               },
    "generation":  {
                       "provider":  "OpenAI",
                       "model":  "built-in image generation",
                       "modelVersion":  null,
                       "prompt":  "Derived NK Cell HUD icon from the approved DEF004 sprite.",
                       "settings":  "transparent PNG; square; selected under standing image approval",
                       "referenceAssetIds":  [
                                                 "DEF004"
                                             ]
                   }
}
