{
    "schemaVersion": 1,
    "recordKind": "ShippableAsset",
    "assetId": "DEF004",
    "manifestCategory": "Defender",
    "purpose": "NK Cell",
    "runtimePath": "Assets/ImmunWar/Art/Defenders/P1/DEF_NKCell.png",
    "fallbackAssetId": "DEF004_FALLBACK",
    "releaseCritical": false,
    "sourceType": "ai_generated",
    "creatorOrProvider": "OpenAI image generation",
    "sourceUrlOrJobId": "exec-e259ef58-2f4e-495f-aff6-e76b4df2c5ab",
    "acquiredOrGeneratedAtUtc": "2026-09-18T15:55:00Z",
    "generation": {
        "provider": "OpenAI",
        "model": "built-in image generation",
        "modelVersion": null,
        "prompt": "Friendly agile NK cell with purple cytotoxic granules and an energy blade, matching the approved P0 character style.",
        "settings": "transparent PNG; square; project P0 style references",
        "referenceAssetIds": ["DEF001", "DEF002", "DEF006", "ENE001"]
    },
    "status": "Approved",
    "rights": {
        "commercialUse": "Allowed",
        "modification": "Allowed",
        "embeddedRedistribution": "Allowed",
        "attribution": "N/A",
        "aiInputUse": "Allowed",
        "territoryOrPlatformLimits": null
    },
    "evidence": {
        "evidenceType": "AIProviderTerms",
        "nameAndVersion": "OpenAI terms reviewed 2026-09-18",
        "urlOrOrderId": "https://openai.com/policies/service-terms/",
        "snapshotPath": "Docs/AssetProvenance/evidence/openai-image-terms-2026-09-18.md",
        "snapshotSha256": "57fa5dc60c51ff83c5a2e7918b30dae570016c5159a6369a905b58eb403cf71c",
        "attributionText": null
    },
    "rawSha256": "0336782cea0dec39584894c374b52d880b9c682f01aaee1e8f337cfe2094b67a",
    "approvedExportSha256": "0336782cea0dec39584894c374b52d880b9c682f01aaee1e8f337cfe2094b67a",
    "recheckAtUtc": "2027-03-18T00:00:00Z",
    "review": {
        "reviewer": "Project owner (confirmed in Codex session)",
        "reviewedAtUtc": "2026-09-18T16:09:15Z",
        "notes": "Approved by the project owner; combat silhouette, faction readability, alpha, provenance, and approved runtime hash verified."
    }
}
