{
    "schemaVersion":  1,
    "recordKind":  "ShippableAsset",
    "assetId":  "AUD006",
    "manifestCategory":  "Audio",
    "purpose":  "Virus Death",
    "runtimePath":  "Assets/ImmunWar/Audio/SFX/P0/SFX_Virus_Death_01.wav",
    "fallbackAssetId":  "PLACEHOLDER_AUD006",
    "releaseCritical":  true,
    "sourceType":  "in_house",
    "creatorOrProvider":  "Immune War procedural audio generator",
    "sourceUrlOrJobId":  "ProductionAudioGenerator/2026-09-19",
    "acquiredOrGeneratedAtUtc":  "2026-09-19T01:00:00Z",
    "status":  "Approved",
    "rights":  {
                   "commercialUse":  "Allowed",
                   "modification":  "Allowed",
                   "embeddedRedistribution":  "Allowed",
                   "attribution":  "N/A",
                   "aiInputUse":  "N/A",
                   "territoryOrPlatformLimits":  ""
               },
    "evidence":  {
                     "evidenceType":  "CreatorDeclaration",
                     "nameAndVersion":  "Immune War in-house procedural declaration 2026-09-18",
                     "urlOrOrderId":  "",
                     "snapshotPath":  "Docs/AssetProvenance/evidence/in-house-procedural-declaration.md",
                     "snapshotSha256":  "0d7bf91b8f5dda6d0bd4743ea41398dc41d0a5be8ea098e2122d158b8ec974ce",
                     "attributionText":  ""
                 },
    "rawSha256":  "6f1bb15a3b91abcc92916e61dea86900fc7ec8eecfc4f355ae4bdb7f1e6782b9",
    "approvedExportSha256":  "6f1bb15a3b91abcc92916e61dea86900fc7ec8eecfc4f355ae4bdb7f1e6782b9",
    "recheckAtUtc":  "2027-03-19T01:12:24Z",
    "review":  {
                   "reviewer":  "Project owner (explicit audio listening approval in Codex session)",
                   "reviewedAtUtc":  "2026-09-19T01:12:24Z",
                   "notes":  "Approved by the project owner after human listening review; PCM format, provenance, and runtime hash verified."
               }
}
