{
  "schemaVersion": 1,
  "recordKind": "ShippableAsset",
  "assetId": "VFX003",
  "manifestCategory": "VFX",
  "purpose": "Hit Burst",
  "runtimePath": "Assets/ImmunWar/Art/VFX/P0/VFX_Hit.png",
  "fallbackAssetId": "PLACEHOLDER_VFX003",
  "releaseCritical": true,
  "sourceType": "ai_generated",
  "creatorOrProvider": "OpenAI image generation",
  "sourceUrlOrJobId": "exec-b07ae55a-9968-441e-918c-e9988fc52b7e",
  "acquiredOrGeneratedAtUtc": "2026-09-19T00:28:00Z",
  "generation": {"provider":"OpenAI","model":"built-in image generation","modelVersion":null,"prompt":"Compact cyan-white biological hit burst with transparent background.","settings":"transparent PNG; square; P0 style references","referenceAssetIds":["DEF002","DEF006","ENE001"]},
  "status": "Approved",
  "rights": {
    "commercialUse": "Allowed",
    "modification": "Allowed",
    "embeddedRedistribution": "Allowed",
    "attribution": "N/A",
    "aiInputUse": "Allowed",
    "territoryOrPlatformLimits": null
  },
  "evidence": {
    "evidenceType": "AIProviderTerms",
    "nameAndVersion": "OpenAI terms reviewed 2026-09-18",
    "urlOrOrderId": "https://openai.com/policies/service-terms/",
    "snapshotPath": "Docs/AssetProvenance/evidence/openai-image-terms-2026-09-18.md",
    "snapshotSha256": "57fa5dc60c51ff83c5a2e7918b30dae570016c5159a6369a905b58eb403cf71c",
    "attributionText": null
  },
  "rawSha256": "4c4873d7ad0ff738958c14b1f28667232463b580431d4831d97d9455d2310ad3",
  "approvedExportSha256": "4c4873d7ad0ff738958c14b1f28667232463b580431d4831d97d9455d2310ad3",
  "recheckAtUtc": "2027-03-19T00:00:00Z",
  "review": {
    "reviewer": "Project owner (standing image approval confirmed in Codex session)",
    "reviewedAtUtc": "2026-09-19T00:28:00Z",
    "notes": "Selected under standing image approval; impact readability, alpha, provenance, and hash verified."
  }
}
