{
    "schemaVersion":  1,
    "recordKind":  "ShippableAsset",
    "assetId":  "VFX006",
    "manifestCategory":  "VFX",
    "purpose":  "Mutation Burst",
    "runtimePath":  "Assets/ImmunWar/Art/VFX/Tactical/VFX_Mutation.png",
    "fallbackAssetId":  "VFX006_FALLBACK",
    "releaseCritical":  false,
    "sourceType":  "ai_generated",
    "creatorOrProvider":  "OpenAI image generation",
    "sourceUrlOrJobId":  "exec-76b3fe9f-5564-4540-8079-8c768f4ca54a",
    "acquiredOrGeneratedAtUtc":  "2026-09-19T00:36:00Z",
    "status":  "Approved",
    "rights":  {
                   "commercialUse":  "Allowed",
                   "modification":  "Allowed",
                   "embeddedRedistribution":  "Allowed",
                   "attribution":  "N/A",
                   "aiInputUse":  "Allowed",
                   "territoryOrPlatformLimits":  null
               },
    "evidence":  {
                     "evidenceType":  "AIProviderTerms",
                     "nameAndVersion":  "OpenAI terms reviewed 2026-09-18",
                     "urlOrOrderId":  "https://openai.com/policies/service-terms/",
                     "snapshotPath":  "Docs/AssetProvenance/evidence/openai-image-terms-2026-09-18.md",
                     "snapshotSha256":  "57fa5dc60c51ff83c5a2e7918b30dae570016c5159a6369a905b58eb403cf71c",
                     "attributionText":  null
                 },
    "rawSha256":  "4b42eba35a9cc57eab8490a61b03220d67900bf4704070a4127e848e3acbc17b",
    "approvedExportSha256":  "4b42eba35a9cc57eab8490a61b03220d67900bf4704070a4127e848e3acbc17b",
    "recheckAtUtc":  "2027-03-19T00:36:00Z",
    "review":  {
                   "reviewer":  "Project owner (standing image approval confirmed in Codex session)",
                   "reviewedAtUtc":  "2026-09-19T00:36:00Z",
                   "notes":  "Selected by Codex under the project owner standing image approval; alpha, provenance, and runtime hash verified."
               },
    "generation":  {
                       "provider":  "OpenAI",
                       "model":  "built-in image generation",
                       "modelVersion":  null,
                       "prompt":  "Magenta mutation burst with lime core and curved fragments.",
                       "settings":  "transparent PNG; square; selected under standing image approval",
                       "referenceAssetIds":  [
                                                 "ENE003"
                                             ]
                   }
}
